source,payload,mechanism,title,date,url,evidence_type,status
PubMed,PBD,DNA crosslinking,Structure and antitumor activity of cupric complexes incorporating 2-(2-pyridyl)benzimidazole derivatives.,2026 Sep,https://pubmed.ncbi.nlm.nih.gov/42096780/,paper,auto_parsed_pending_review
PubMed,PBD,DNA crosslinking,"Plant-Based Diets, Ultra-Processed Foods, and Risks of Mortality and Major Chronic Diseases: A Prospective Cohort Study.",2026 Aug,https://pubmed.ncbi.nlm.nih.gov/42294356/,paper,auto_parsed_pending_review
PubMed,PBD,DNA crosslinking,Preoperative Biliary Drainage with Metal Stent Versus Early Surgery in Patients with Pancreatic Cancer: A Randomized Clinical Trial.,2026 Jul,https://pubmed.ncbi.nlm.nih.gov/41951900/,paper,auto_parsed_pending_review
PubMed,PBD,DNA crosslinking,Quantitative Diffusion and T2 Mapping Using RF-Modulated Phase-Based Gradient Echo Imaging.,2026 Jul,https://pubmed.ncbi.nlm.nih.gov/41814128/,paper,auto_parsed_pending_review
PubMed,PBD,DNA crosslinking,Development of Glypican-3-Targeting Antibody-Drug Conjugates for Hepatocellular Carcinoma Therapy.,2026 Jun 16,https://pubmed.ncbi.nlm.nih.gov/42302184/,paper,auto_parsed_pending_review
Crossref,PBD,DNA crosslinking,Optimizing Registered Nurse Roles in the Delivery of Cancer Survivorship Care within Primary Care Settings,2106-12-6,https://doi.org/10.12927/cjnl.2016.24984,paper_metadata,auto_parsed_pending_review
Crossref,PBD,DNA crosslinking,Comparative  Study of Serum Lipid Profile Parameters  for Oral Cancer  and Non Oral Cancer Patients,2106-6-20,https://doi.org/10.21276/ijchmr.2016.2.2.08,paper_metadata,auto_parsed_pending_review
Crossref,PBD,DNA crosslinking,From Policy to Practice: Assessing the Impact of Staging Policies for Recording Cancer Stage across Canada,2088-1-15,https://doi.org/10.12927/hcq.2013.19505,paper_metadata,auto_parsed_pending_review
Crossref,PBD,DNA crosslinking,USING OF LAB ANIMALS AS A MODEL TO STUDY THE DRUG TOXICITY IN COVID-19,2031-8-1,https://doi.org/10.23975/bjvetr.2031.175853,paper_metadata,auto_parsed_pending_review
Crossref,PBD,DNA crosslinking,Postures communicationnelles des spécialistes en médecine générale dans le dépistage familial du cancer colorectal,2030-1-1,https://doi.org/10.3917/spub.pr2.0060,paper_metadata,auto_parsed_pending_review
ClinicalTrials.gov,PBD,DNA crosslinking,Longitudinal Natural History Study of Patients With Peroxisome Biogenesis Disorders (PBD),2025-12-03,https://clinicaltrials.gov/study/NCT01668186,clinical_trial,auto_parsed_pending_review
ClinicalTrials.gov,PBD,DNA crosslinking,Study of ADCT-402 in Patients With Relapsed or Refractory B-cell Lineage Acute Lymphoblastic Leukemia (B-ALL),2021-04-27,https://clinicaltrials.gov/study/NCT02669264,clinical_trial,auto_parsed_pending_review
ClinicalTrials.gov,PBD,DNA crosslinking,Pathogenesis of Atypical Femur Fractures on Long Term Bisphosphonate Therapy,2019-03-28,https://clinicaltrials.gov/study/NCT02155595,clinical_trial,auto_parsed_pending_review
ClinicalTrials.gov,PBD,DNA crosslinking,"A First-in-Human Phase I Trial With Antibody Drug Conjugate ADCT-701 in Neuroendocrine Tumors, Carcinomas and Malignant Peripheral Nerve Sheath Tumors",2026-06-12,https://clinicaltrials.gov/study/NCT06041516,clinical_trial,auto_parsed_pending_review
ClinicalTrials.gov,PBD,DNA crosslinking,Specific Bile Microorganisms Caused Intra-abdominal Abscess on Pancreaticoduodenectomy Patients: Customized Antibiotics And Antifungal Medication May Be Necessary,2021-08-15,https://clinicaltrials.gov/study/NCT05011630,clinical_trial,auto_parsed_pending_review
PubMed,amanitin,RNA polymerase II inhibitor,"Fungal ribosomally synthesized and post-translationally modified peptides (F-RiPPs): Biosynthesis, genome mining, structural diversity, and translational potential as targeted anticancer ADC payloads.",2026 May 12,https://pubmed.ncbi.nlm.nih.gov/42119713/,paper,auto_parsed_pending_review
PubMed,amanitin,RNA polymerase II inhibitor,Amanitin-Based Fc-Small Molecule Drug Conjugates with Non-Cleavable Linker: A Novel Therapeutic Strategy for Prostate Cancer Targeted Therapy.,2026 Mar 17,https://pubmed.ncbi.nlm.nih.gov/41841414/,paper,auto_parsed_pending_review
PubMed,amanitin,RNA polymerase II inhibitor,Advances in Immunotherapy for HER2 Low-Expressing Triple-Negative Breast Cancer.,2025,https://pubmed.ncbi.nlm.nih.gov/41356427/,paper,auto_parsed_pending_review
PubMed,amanitin,RNA polymerase II inhibitor,Site-Specific Modification of Native IgGs with Flexible Drug-Load.,2025 Apr 14,https://pubmed.ncbi.nlm.nih.gov/39305147/,paper,auto_parsed_pending_review
PubMed,amanitin,RNA polymerase II inhibitor,Novel Amanitin-Based Antibody-Drug Conjugates Targeting TROP2 for the Treatment of Pancreatic Cancer.,2025 Apr 2,https://pubmed.ncbi.nlm.nih.gov/39564769/,paper,auto_parsed_pending_review
Crossref,amanitin,RNA polymerase II inhibitor,Optimizing Registered Nurse Roles in the Delivery of Cancer Survivorship Care within Primary Care Settings,2106-12-6,https://doi.org/10.12927/cjnl.2016.24984,paper_metadata,auto_parsed_pending_review
Crossref,amanitin,RNA polymerase II inhibitor,Comparative  Study of Serum Lipid Profile Parameters  for Oral Cancer  and Non Oral Cancer Patients,2106-6-20,https://doi.org/10.21276/ijchmr.2016.2.2.08,paper_metadata,auto_parsed_pending_review
Crossref,amanitin,RNA polymerase II inhibitor,From Policy to Practice: Assessing the Impact of Staging Policies for Recording Cancer Stage across Canada,2088-1-15,https://doi.org/10.12927/hcq.2013.19505,paper_metadata,auto_parsed_pending_review
Crossref,amanitin,RNA polymerase II inhibitor,USING OF LAB ANIMALS AS A MODEL TO STUDY THE DRUG TOXICITY IN COVID-19,2031-8-1,https://doi.org/10.23975/bjvetr.2031.175853,paper_metadata,auto_parsed_pending_review
Crossref,amanitin,RNA polymerase II inhibitor,Postures communicationnelles des spécialistes en médecine générale dans le dépistage familial du cancer colorectal,2030-1-1,https://doi.org/10.3917/spub.pr2.0060,paper_metadata,auto_parsed_pending_review
