source,payload,mechanism,title,date,url,evidence_type,status
PubMed,DXd,TOP1 inhibitor,Antibodies to watch in 2026.,2026 Dec,https://pubmed.ncbi.nlm.nih.gov/41560619/,paper,auto_parsed_pending_review
PubMed,DXd,TOP1 inhibitor,EGFR S442 ectodomain mutation confers cetuximab resistance that can be overcome by ERBB2 blockade with trastuzumab-deruxtecan.,2026 Aug 28,https://pubmed.ncbi.nlm.nih.gov/42176792/,paper,auto_parsed_pending_review
PubMed,DXd,TOP1 inhibitor,ATR inhibition potentiates the antitumor efficacy of HER3-DXd in HER3-positive/HR-positive breast cancer by increasing DNA damage.,2026 Jul,https://pubmed.ncbi.nlm.nih.gov/41986659/,paper,auto_parsed_pending_review
PubMed,DXd,TOP1 inhibitor,Dynamic monitoring of antibody drug conjugates targeting TROP2 or HER2 in breast cancer using circulating tumor cells.,2026 Jun 23,https://pubmed.ncbi.nlm.nih.gov/42308036/,paper,auto_parsed_pending_review
PubMed,DXd,TOP1 inhibitor,Clinical responses to trastuzumab deruxtecan in molecularly defined ependymoma.,2026 Jun 20,https://pubmed.ncbi.nlm.nih.gov/42321415/,paper,auto_parsed_pending_review
Crossref,DXd,TOP1 inhibitor,Optimizing Registered Nurse Roles in the Delivery of Cancer Survivorship Care within Primary Care Settings,2106-12-6,https://doi.org/10.12927/cjnl.2016.24984,paper_metadata,auto_parsed_pending_review
Crossref,DXd,TOP1 inhibitor,Comparative  Study of Serum Lipid Profile Parameters  for Oral Cancer  and Non Oral Cancer Patients,2106-6-20,https://doi.org/10.21276/ijchmr.2016.2.2.08,paper_metadata,auto_parsed_pending_review
Crossref,DXd,TOP1 inhibitor,From Policy to Practice: Assessing the Impact of Staging Policies for Recording Cancer Stage across Canada,2088-1-15,https://doi.org/10.12927/hcq.2013.19505,paper_metadata,auto_parsed_pending_review
Crossref,DXd,TOP1 inhibitor,USING OF LAB ANIMALS AS A MODEL TO STUDY THE DRUG TOXICITY IN COVID-19,2031-8-1,https://doi.org/10.23975/bjvetr.2031.175853,paper_metadata,auto_parsed_pending_review
Crossref,DXd,TOP1 inhibitor,Postures communicationnelles des spécialistes en médecine générale dans le dépistage familial du cancer colorectal,2030-1-1,https://doi.org/10.3917/spub.pr2.0060,paper_metadata,auto_parsed_pending_review
ClinicalTrials.gov,DXd,TOP1 inhibitor,Anlotinib With Trastuzumab Deruxtecan for Previously Treated HER2-Low Advanced Breast Cancer,2024-08-28,https://clinicaltrials.gov/study/NCT06331169,clinical_trial,auto_parsed_pending_review
ClinicalTrials.gov,DXd,TOP1 inhibitor,"Phase III, Open-label, First-line Study of Dato-DXd in Combination With Durvalumab and Carboplatin for Advanced NSCLC Without Actionable Genomic Alterations",2026-04-21,https://clinicaltrials.gov/study/NCT05687266,clinical_trial,auto_parsed_pending_review
ClinicalTrials.gov,DXd,TOP1 inhibitor,EIS-12656 as Single Agent and in Combination in Patients With Specified Solid Tumors,2024-09-14,https://clinicaltrials.gov/study/NCT06525298,clinical_trial,auto_parsed_pending_review
ClinicalTrials.gov,DXd,TOP1 inhibitor,"A Window-of-opportunity Study of U3-1402, a HER3-targeting Antibody-drug Conjugate in Operable Breast Cancer According to ERBB3 Expression",2023-06-21,https://clinicaltrials.gov/study/NCT04610528,clinical_trial,auto_parsed_pending_review
ClinicalTrials.gov,DXd,TOP1 inhibitor,Trastuzumab Deruxtecan Plus ivonescImab for Hormone Receptor-positive HER2 Negative Advanced Breast Cancer Study,2026-06-09,https://clinicaltrials.gov/study/NCT07647016,clinical_trial,auto_parsed_pending_review
PubMed,exatecan,TOP1 inhibitor,NH(2)-trimethyl lock (NH(2)-TML): a stable and effective adapter for exatecan-based antibody-drug conjugates.,2026 Sep 5,https://pubmed.ncbi.nlm.nih.gov/42218895/,paper,auto_parsed_pending_review
PubMed,exatecan,TOP1 inhibitor,Vascular disruption-triggered physiological cascade enables a therapeutic window for fibrin-hypoxia dual-targeting nanomedicines in solid tumors.,2026 Jul 10,https://pubmed.ncbi.nlm.nih.gov/42119788/,paper,auto_parsed_pending_review
PubMed,exatecan,TOP1 inhibitor,"An intrinsically hydrophilic linker enables a stable, high-DAR exatecan-based HER2 ADC with potent antitumor activity.",2026 Jun 10,https://pubmed.ncbi.nlm.nih.gov/42296596/,paper,auto_parsed_pending_review
PubMed,exatecan,TOP1 inhibitor,Sequential Use of Trastuzumab Deruxtecan and Sacituzumab Govitecan in Patients with Breast Cancer: A Pharmacological Approach to Support the Clinical Rationale.,2026 Jun,https://pubmed.ncbi.nlm.nih.gov/41931218/,paper,auto_parsed_pending_review
PubMed,exatecan,TOP1 inhibitor,Exatecan Payload-Based Antibody-Drug Conjugates with a Short Hydrophilic Cleavable Linker.,2026 May 14,https://pubmed.ncbi.nlm.nih.gov/42157849/,paper,auto_parsed_pending_review
Crossref,exatecan,TOP1 inhibitor,Optimizing Registered Nurse Roles in the Delivery of Cancer Survivorship Care within Primary Care Settings,2106-12-6,https://doi.org/10.12927/cjnl.2016.24984,paper_metadata,auto_parsed_pending_review
Crossref,exatecan,TOP1 inhibitor,Comparative  Study of Serum Lipid Profile Parameters  for Oral Cancer  and Non Oral Cancer Patients,2106-6-20,https://doi.org/10.21276/ijchmr.2016.2.2.08,paper_metadata,auto_parsed_pending_review
Crossref,exatecan,TOP1 inhibitor,From Policy to Practice: Assessing the Impact of Staging Policies for Recording Cancer Stage across Canada,2088-1-15,https://doi.org/10.12927/hcq.2013.19505,paper_metadata,auto_parsed_pending_review
Crossref,exatecan,TOP1 inhibitor,USING OF LAB ANIMALS AS A MODEL TO STUDY THE DRUG TOXICITY IN COVID-19,2031-8-1,https://doi.org/10.23975/bjvetr.2031.175853,paper_metadata,auto_parsed_pending_review
Crossref,exatecan,TOP1 inhibitor,Postures communicationnelles des spécialistes en médecine générale dans le dépistage familial du cancer colorectal,2030-1-1,https://doi.org/10.3917/spub.pr2.0060,paper_metadata,auto_parsed_pending_review
ClinicalTrials.gov,exatecan,TOP1 inhibitor,Anti-Ly6E Exatecan ADC M7437 in Advanced Solid Tumors,2026-06-10,https://clinicaltrials.gov/study/NCT07360314,clinical_trial,auto_parsed_pending_review
ClinicalTrials.gov,exatecan,TOP1 inhibitor,A Study to Evaluate ELU001 in Patients With Solid Tumors That Overexpress Folate Receptor Alpha (FRα),2024-08-05,https://clinicaltrials.gov/study/NCT05001282,clinical_trial,auto_parsed_pending_review
ClinicalTrials.gov,exatecan,TOP1 inhibitor,DX-8951f in Treating Patients With Biliary Cancer,2012-05-15,https://clinicaltrials.gov/study/NCT00005938,clinical_trial,auto_parsed_pending_review
ClinicalTrials.gov,exatecan,TOP1 inhibitor,A Study of CBX 12 in Subjects With Platinum Resistant or Refractory Ovarian Cancer,2025-10-02,https://clinicaltrials.gov/study/NCT06315491,clinical_trial,auto_parsed_pending_review
ClinicalTrials.gov,exatecan,TOP1 inhibitor,HER3-DXd in Breast Cancer and NSCLC Brain Metastases and Solid Tumor Leptomeningeal Disease,2026-04-28,https://clinicaltrials.gov/study/NCT05865990,clinical_trial,auto_parsed_pending_review
PubMed,SN-38,TOP1 inhibitor,A preliminary exploratory clinical study of Xiao-Chai-Hu-Tang co-administered with irinotecan-based chemotherapy in advanced colorectal cancer.,2026 Aug 10,https://pubmed.ncbi.nlm.nih.gov/42002120/,paper,auto_parsed_pending_review
PubMed,SN-38,TOP1 inhibitor,"Harnessing human colonoid-derived monolayers as an in vitro platform for investigating accumulation, toxicity, and pharmacodynamics of small molecules.",2026 Aug,https://pubmed.ncbi.nlm.nih.gov/41796873/,paper,auto_parsed_pending_review
PubMed,SN-38,TOP1 inhibitor,Dual benefits of Xiao Chai Hu Tang and its active compounds in CPT-11 therapy: intestinal protection via barrier restoration and anti-inflammation combined with enhanced tumor apoptosis.,2026 Jul 15,https://pubmed.ncbi.nlm.nih.gov/41932664/,paper,auto_parsed_pending_review
PubMed,SN-38,TOP1 inhibitor,Toward targeting the untargetable: A non-canonical EGFR-peptide-drug conjugate achieves potent antitumor activity in KRAS-mutant CRC.,2026 Jul 10,https://pubmed.ncbi.nlm.nih.gov/42103029/,paper,auto_parsed_pending_review
PubMed,SN-38,TOP1 inhibitor,Transformable nanoassembly of CXCL16 peptide-SN38 conjugate improves intratumor permeation and retention in peritoneal metastases.,2026 Jul 10,https://pubmed.ncbi.nlm.nih.gov/42069001/,paper,auto_parsed_pending_review
Crossref,SN-38,TOP1 inhibitor,The effects of autologous platelet concentrate on the healing of intra-bony defects: a randomized clinical trial,2109-1-31,https://doi.org/10.26650/eor.20192207101715,paper_metadata,auto_parsed_pending_review
Crossref,SN-38,TOP1 inhibitor,Optimizing Registered Nurse Roles in the Delivery of Cancer Survivorship Care within Primary Care Settings,2106-12-6,https://doi.org/10.12927/cjnl.2016.24984,paper_metadata,auto_parsed_pending_review
Crossref,SN-38,TOP1 inhibitor,Need of Hearing Assistance Technology (HAT) for Adults with Hearing Impairment,2106-6-20,https://doi.org/10.21276/ijchmr.2016.2.2.06,paper_metadata,auto_parsed_pending_review
Crossref,SN-38,TOP1 inhibitor,Comparative  Study of Serum Lipid Profile Parameters  for Oral Cancer  and Non Oral Cancer Patients,2106-6-20,https://doi.org/10.21276/ijchmr.2016.2.2.08,paper_metadata,auto_parsed_pending_review
Crossref,SN-38,TOP1 inhibitor,Организационно-педагогические условия и критерии эффективности формирования развивающей среды общеобразовательного учреждения Organizational - pedagogical conditions and criteria of efficiency of formation of the developing environment of general education establishment,2088-6-30,https://doi.org/10.21702/rpj.2008.2.3,paper_metadata,auto_parsed_pending_review
ClinicalTrials.gov,SN-38,TOP1 inhibitor,The BEACON Study (Breast Cancer Outcomes With NKTR-102),2021-05-06,https://clinicaltrials.gov/study/NCT01492101,clinical_trial,auto_parsed_pending_review
ClinicalTrials.gov,SN-38,TOP1 inhibitor,Phase 2 Etirinotecan Pegol in Refractory Brain Metastases & Advanced Lung Cancer / Metastatic Breast Cancer,2023-11-20,https://clinicaltrials.gov/study/NCT02312622,clinical_trial,auto_parsed_pending_review
ClinicalTrials.gov,SN-38,TOP1 inhibitor,MEK Inhibitor MSC1936369B Plus FOLFIRI in Second Line K-Ras Mutated Metastatic Colorectal Cancer (mCRC),2016-08-24,https://clinicaltrials.gov/study/NCT01085331,clinical_trial,auto_parsed_pending_review
ClinicalTrials.gov,SN-38,TOP1 inhibitor,A Study of TBio-4101 (TIL) and Pembrolizumab in Patients With Advanced Solid Tumors,2025-03-07,https://clinicaltrials.gov/study/NCT05576077,clinical_trial,auto_parsed_pending_review
ClinicalTrials.gov,SN-38,TOP1 inhibitor,Evaluation of the Preliminary Efficacy and Safety of DR30206 in Combination With Standard Therapy in Patients With Gastrointestinal Cancer,2026-01-09,https://clinicaltrials.gov/study/NCT07056777,clinical_trial,auto_parsed_pending_review
PubMed,MMAE,microtubule inhibitor,Targeting IL-7Rα with PNU-159682 antibody-drug conjugates in acute lymphoblastic leukemia: translational implications.,2026 Dec 31,https://pubmed.ncbi.nlm.nih.gov/42046337/,paper,auto_parsed_pending_review
PubMed,MMAE,microtubule inhibitor,Mislocalisation of FLT3-ITD receptor contributes to MV4-11 leukaemia cell resistance to antibody-drug conjugate.,2026 Dec,https://pubmed.ncbi.nlm.nih.gov/41784256/,paper,auto_parsed_pending_review
PubMed,MMAE,microtubule inhibitor,Construction of anti-HER2 conjugated injectable hydrogel via protein crosslinking and gadolinium-tetraaza coordination for multimodal tumor theranostics.,2026 Aug,https://pubmed.ncbi.nlm.nih.gov/41934787/,paper,auto_parsed_pending_review
PubMed,MMAE,microtubule inhibitor,Development and validation of an efficient and sensitive LC-MS/MS assay for simultaneous determination of the high frequency used antibody drug conjugate payload MMAE and anti-vascular tyrosine kinase inhibitor lenvatinib in human plasma.,2026 Jul 15,https://pubmed.ncbi.nlm.nih.gov/41762484/,paper,auto_parsed_pending_review
PubMed,MMAE,microtubule inhibitor,Glypican-1-targeted antibody-drug conjugate shows therapeutic efficacy in lung squamous cell carcinoma.,2026 Jul,https://pubmed.ncbi.nlm.nih.gov/42096801/,paper,auto_parsed_pending_review
Crossref,MMAE,microtubule inhibitor,Optimizing Registered Nurse Roles in the Delivery of Cancer Survivorship Care within Primary Care Settings,2106-12-6,https://doi.org/10.12927/cjnl.2016.24984,paper_metadata,auto_parsed_pending_review
Crossref,MMAE,microtubule inhibitor,Comparative  Study of Serum Lipid Profile Parameters  for Oral Cancer  and Non Oral Cancer Patients,2106-6-20,https://doi.org/10.21276/ijchmr.2016.2.2.08,paper_metadata,auto_parsed_pending_review
Crossref,MMAE,microtubule inhibitor,From Policy to Practice: Assessing the Impact of Staging Policies for Recording Cancer Stage across Canada,2088-1-15,https://doi.org/10.12927/hcq.2013.19505,paper_metadata,auto_parsed_pending_review
Crossref,MMAE,microtubule inhibitor,USING OF LAB ANIMALS AS A MODEL TO STUDY THE DRUG TOXICITY IN COVID-19,2031-8-1,https://doi.org/10.23975/bjvetr.2031.175853,paper_metadata,auto_parsed_pending_review
Crossref,MMAE,microtubule inhibitor,Postures communicationnelles des spécialistes en médecine générale dans le dépistage familial du cancer colorectal,2030-1-1,https://doi.org/10.3917/spub.pr2.0060,paper_metadata,auto_parsed_pending_review
ClinicalTrials.gov,MMAE,microtubule inhibitor,Brentuximab Vedotin Plus AD in Non-bulky Limited Stage Hodgkin Lymphoma,2020-08-10,https://clinicaltrials.gov/study/NCT02505269,clinical_trial,auto_parsed_pending_review
ClinicalTrials.gov,MMAE,microtubule inhibitor,Study of EV for Recurrent Endometrial Carcinoma,2026-01-16,https://clinicaltrials.gov/study/NCT07139977,clinical_trial,auto_parsed_pending_review
ClinicalTrials.gov,MMAE,microtubule inhibitor,A Study of HDM2005 in Combination With Standard of Care in Patients With Diffuse Large B-Cell Lymphoma,2025-08-11,https://clinicaltrials.gov/study/NCT07124936,clinical_trial,auto_parsed_pending_review
ClinicalTrials.gov,MMAE,microtubule inhibitor,A Study of Brentuximab Vedotin Combined With Nivolumab for Relapsed or Refractory Hodgkin Lymphoma,2022-10-17,https://clinicaltrials.gov/study/NCT02572167,clinical_trial,auto_parsed_pending_review
ClinicalTrials.gov,MMAE,microtubule inhibitor,A Study of RC118 in Patients With Locally Advanced Unresectable/Metastatic Solid Tumours,2023-06-19,https://clinicaltrials.gov/study/NCT04914117,clinical_trial,auto_parsed_pending_review
PubMed,MMAF,microtubule inhibitor,Peptide-drug conjugates bearing an antimitotic Ahx-DA1 payload achieve potent antitumor activity in Her2-amplified and EGFR-positive KRAS-mutant cancers in vivo.,2026 Jul,https://pubmed.ncbi.nlm.nih.gov/42033924/,paper,auto_parsed_pending_review
PubMed,MMAF,microtubule inhibitor,uPAR-Targeting Cytotoxic Antibody-Drug Conjugates Selectively Deplete Proinflammatory Myeloid Cells for Autoimmune Indications.,2026 Apr 29,https://pubmed.ncbi.nlm.nih.gov/42121904/,paper,auto_parsed_pending_review
PubMed,MMAF,microtubule inhibitor,Mechanism of uptake and toxicity of a BCMA antibody drug conjugate with a MMAF payload by nonantigen expressing cells.,2026 Apr 8,https://pubmed.ncbi.nlm.nih.gov/41951857/,paper,auto_parsed_pending_review
PubMed,MMAF,microtubule inhibitor,Rational payload selection enables high antitumoral efficacy of an anti-EGFR antibody-drug conjugate against ovarian tumors.,2026 Apr,https://pubmed.ncbi.nlm.nih.gov/41825107/,paper,auto_parsed_pending_review
PubMed,MMAF,microtubule inhibitor,Characterization of drug-drug interaction for antibody-drug conjugates and risk assessment using various approaches including physiologically based pharmacokinetic modeling.,2026 Apr,https://pubmed.ncbi.nlm.nih.gov/41671915/,paper,auto_parsed_pending_review
Crossref,MMAF,microtubule inhibitor,Optimizing Registered Nurse Roles in the Delivery of Cancer Survivorship Care within Primary Care Settings,2106-12-6,https://doi.org/10.12927/cjnl.2016.24984,paper_metadata,auto_parsed_pending_review
Crossref,MMAF,microtubule inhibitor,Comparative  Study of Serum Lipid Profile Parameters  for Oral Cancer  and Non Oral Cancer Patients,2106-6-20,https://doi.org/10.21276/ijchmr.2016.2.2.08,paper_metadata,auto_parsed_pending_review
Crossref,MMAF,microtubule inhibitor,From Policy to Practice: Assessing the Impact of Staging Policies for Recording Cancer Stage across Canada,2088-1-15,https://doi.org/10.12927/hcq.2013.19505,paper_metadata,auto_parsed_pending_review
Crossref,MMAF,microtubule inhibitor,USING OF LAB ANIMALS AS A MODEL TO STUDY THE DRUG TOXICITY IN COVID-19,2031-8-1,https://doi.org/10.23975/bjvetr.2031.175853,paper_metadata,auto_parsed_pending_review
Crossref,MMAF,microtubule inhibitor,Postures communicationnelles des spécialistes en médecine générale dans le dépistage familial du cancer colorectal,2030-1-1,https://doi.org/10.3917/spub.pr2.0060,paper_metadata,auto_parsed_pending_review
ClinicalTrials.gov,MMAF,microtubule inhibitor,"To Evaluate Safety, Tolerability, and Clinical Activity of the Antibody-drug Conjugate, GSK2857916 Administered in Combination With Lenalidomide Plus Dexamethasone (Arm A), or in Combination With Bortezomib Plus Dexamethasone (Arm B) in Participants With Relapsed/Refractory Multiple Myeloma (RRMM)",2025-02-27,https://clinicaltrials.gov/study/NCT03544281,clinical_trial,auto_parsed_pending_review
ClinicalTrials.gov,MMAF,microtubule inhibitor,"Evaluation of Efficacy and Safety of Belantamab Mafodotin, Bortezomib and Dexamethasone Versus Daratumumab, Bortezomib and Dexamethasone in Participants With Relapsed/Refractory Multiple Myeloma",2026-04-03,https://clinicaltrials.gov/study/NCT04246047,clinical_trial,auto_parsed_pending_review
ClinicalTrials.gov,MMAF,microtubule inhibitor,Clinical Study of Antibody-Drug Conjugate MYTX-011 in Subjects With Non-Small Cell Lung Cancer,2025-12-15,https://clinicaltrials.gov/study/NCT05652868,clinical_trial,auto_parsed_pending_review
ClinicalTrials.gov,MMAF,microtubule inhibitor,"A Study of Belantamab Mafodotin to Investigate Safety, Tolerability, Pharmacokinetics, Immunogenicity and Clinical Activity in Participants With Relapsed/Refractory Multiple Myeloma (RRMM)",2025-02-28,https://clinicaltrials.gov/study/NCT04177823,clinical_trial,auto_parsed_pending_review
ClinicalTrials.gov,MMAF,microtubule inhibitor,Phase 1 Study of FS-1502 in Patients With HER2 Expressed Advanced Solid Tumors and Breast Cancer.,2025-09-09,https://clinicaltrials.gov/study/NCT03944499,clinical_trial,auto_parsed_pending_review
PubMed,DM1,microtubule inhibitor,Optical mapping reveals a higher level of large-scale structural variants in a family with paternally transmitted myotonic dystrophy and independent Parkinson's disease.,2026 Jun 9,https://pubmed.ncbi.nlm.nih.gov/42261605/,paper,auto_parsed_pending_review
PubMed,DM1,microtubule inhibitor,Prognostic Role of Inflammatory Indices and Real-World Outcomes in HER2-Positive Metastatic Breast Cancer Treated with Trastuzumab Emtansine.,2026 Jun 5,https://pubmed.ncbi.nlm.nih.gov/42279613/,paper,auto_parsed_pending_review
PubMed,DM1,microtubule inhibitor,Safety of concurrent T-DM1 and radiation therapy in HER2-positive breast cancer with residual disease after neoadjuvant chemotherapy.,2026 Jun 4,https://pubmed.ncbi.nlm.nih.gov/42240561/,paper,auto_parsed_pending_review
PubMed,DM1,microtubule inhibitor,"Next-generation antibody-drug conjugates in drug-resistant solid tumors: promise, toxicity, and the emerging challenge of acquired resistance.",2026 Jun,https://pubmed.ncbi.nlm.nih.gov/42254250/,paper,auto_parsed_pending_review
PubMed,DM1,microtubule inhibitor,"A chemotherapy-free, pathological response-adapted strategy using trastuzumab-pertuzumab and T-DM1 in HER2-positive early breast cancer: the PHERGain-2 study.",2026 Jun,https://pubmed.ncbi.nlm.nih.gov/42097893/,paper,auto_parsed_pending_review
Crossref,DM1,microtubule inhibitor,Optimizing Registered Nurse Roles in the Delivery of Cancer Survivorship Care within Primary Care Settings,2106-12-6,https://doi.org/10.12927/cjnl.2016.24984,paper_metadata,auto_parsed_pending_review
Crossref,DM1,microtubule inhibitor,Comparative  Study of Serum Lipid Profile Parameters  for Oral Cancer  and Non Oral Cancer Patients,2106-6-20,https://doi.org/10.21276/ijchmr.2016.2.2.08,paper_metadata,auto_parsed_pending_review
Crossref,DM1,microtubule inhibitor,From Policy to Practice: Assessing the Impact of Staging Policies for Recording Cancer Stage across Canada,2088-1-15,https://doi.org/10.12927/hcq.2013.19505,paper_metadata,auto_parsed_pending_review
Crossref,DM1,microtubule inhibitor,USING OF LAB ANIMALS AS A MODEL TO STUDY THE DRUG TOXICITY IN COVID-19,2031-8-1,https://doi.org/10.23975/bjvetr.2031.175853,paper_metadata,auto_parsed_pending_review
Crossref,DM1,microtubule inhibitor,Postures communicationnelles des spécialistes en médecine générale dans le dépistage familial du cancer colorectal,2030-1-1,https://doi.org/10.3917/spub.pr2.0060,paper_metadata,auto_parsed_pending_review
ClinicalTrials.gov,DM1,microtubule inhibitor,Evaluation of Adult Patients With Immunodeficiency Within the Scope of the ICF,2024-02-26,https://clinicaltrials.gov/study/NCT06014463,clinical_trial,auto_parsed_pending_review
ClinicalTrials.gov,DM1,microtubule inhibitor,Efficacy and Tolerance of Early Launching of Nocturnal Non Invasive,2017-11-17,https://clinicaltrials.gov/study/NCT01225614,clinical_trial,auto_parsed_pending_review
ClinicalTrials.gov,DM1,microtubule inhibitor,A Study Of Pembrolizumab In Combination With Trastuzumab-DM1,2025-01-14,https://clinicaltrials.gov/study/NCT03032107,clinical_trial,auto_parsed_pending_review
ClinicalTrials.gov,DM1,microtubule inhibitor,Pyrotinib in Women With High-risk in Early Stage Breast Cancer,2023-04-26,https://clinicaltrials.gov/study/NCT05834764,clinical_trial,auto_parsed_pending_review
ClinicalTrials.gov,DM1,microtubule inhibitor,A Study of Targeted Agents for Patients With Recurrent or Persistent Endometrial Cancer,2026-03-31,https://clinicaltrials.gov/study/NCT04486352,clinical_trial,auto_parsed_pending_review
PubMed,DM4,microtubule inhibitor,The SDC1-ENO1 Axis in Cancer-Associated Fibroblasts Generates a Lactate-Rich Microenvironment That Drives Tumor Radioresistance.,2026 Jun 15,https://pubmed.ncbi.nlm.nih.gov/41812066/,paper,auto_parsed_pending_review
PubMed,DM4,microtubule inhibitor,Mirvetuximab soravtansine in platinum-resistant ovarian cancer: from biological rationale to clinical impact and future directions.,2026 Jun 13,https://pubmed.ncbi.nlm.nih.gov/42287581/,paper,auto_parsed_pending_review
PubMed,DM4,microtubule inhibitor,Human germline-like monoclonal antibody against 5T4 enables potent ADC and CAR-T therapies for solid tumors.,2026 May,https://pubmed.ncbi.nlm.nih.gov/41593208/,paper,auto_parsed_pending_review
PubMed,DM4,microtubule inhibitor,Defining the Functional Role and Potential as an Immunotherapeutic Target of ALCAM in Neuroblastoma.,2026 Apr 2,https://pubmed.ncbi.nlm.nih.gov/41202161/,paper,auto_parsed_pending_review
PubMed,DM4,microtubule inhibitor,Characterization of drug-drug interaction for antibody-drug conjugates and risk assessment using various approaches including physiologically based pharmacokinetic modeling.,2026 Apr,https://pubmed.ncbi.nlm.nih.gov/41671915/,paper,auto_parsed_pending_review
Crossref,DM4,microtubule inhibitor,Optimizing Registered Nurse Roles in the Delivery of Cancer Survivorship Care within Primary Care Settings,2106-12-6,https://doi.org/10.12927/cjnl.2016.24984,paper_metadata,auto_parsed_pending_review
Crossref,DM4,microtubule inhibitor,Comparative  Study of Serum Lipid Profile Parameters  for Oral Cancer  and Non Oral Cancer Patients,2106-6-20,https://doi.org/10.21276/ijchmr.2016.2.2.08,paper_metadata,auto_parsed_pending_review
Crossref,DM4,microtubule inhibitor,From Policy to Practice: Assessing the Impact of Staging Policies for Recording Cancer Stage across Canada,2088-1-15,https://doi.org/10.12927/hcq.2013.19505,paper_metadata,auto_parsed_pending_review
Crossref,DM4,microtubule inhibitor,USING OF LAB ANIMALS AS A MODEL TO STUDY THE DRUG TOXICITY IN COVID-19,2031-8-1,https://doi.org/10.23975/bjvetr.2031.175853,paper_metadata,auto_parsed_pending_review
Crossref,DM4,microtubule inhibitor,Postures communicationnelles des spécialistes en médecine générale dans le dépistage familial du cancer colorectal,2030-1-1,https://doi.org/10.3917/spub.pr2.0060,paper_metadata,auto_parsed_pending_review
ClinicalTrials.gov,DM4,microtubule inhibitor,Phase Ib Study of Anetumab Ravtansine in Combination With Pegylated Liposomal Doxorubicin in Patients With Recurrent Mesothelin-expressing Platinum-resistant Cancer,2019-11-21,https://clinicaltrials.gov/study/NCT02751918,clinical_trial,auto_parsed_pending_review
ClinicalTrials.gov,DM4,microtubule inhibitor,Mirvetuximab Soravtansine (IMG853) in Folate Receptor Alpha-expressing TNBC,2018-07-02,https://clinicaltrials.gov/study/NCT03045393,clinical_trial,auto_parsed_pending_review
ClinicalTrials.gov,DM4,microtubule inhibitor,A Phase I Study of BIIB015 in Relapsed/Refractory Solid Tumors,2013-09-12,https://clinicaltrials.gov/study/NCT00674947,clinical_trial,auto_parsed_pending_review
ClinicalTrials.gov,DM4,microtubule inhibitor,A Three-Part Phase 3 Study of Sofetabart Mipitecan in Participants With Platinum-Resistant (Part A) and Platinum-Sensitive (Parts B and C) Ovarian Cancer,2026-06-11,https://clinicaltrials.gov/study/NCT07213804,clinical_trial,auto_parsed_pending_review
ClinicalTrials.gov,DM4,microtubule inhibitor,Maytansinoid DM4-Conjugated Humanized Monoclonal Antibody huC242 in Treating Patients With Solid Tumors,2010-03-16,https://clinicaltrials.gov/study/NCT00352131,clinical_trial,auto_parsed_pending_review
